{
  "id": "pkg-mu3hi5us-of6y06",
  "candidateId": "cand-anatomi-ai-dan-penerapan-pemasaran",
  "articleId": "art-anatomi-ai-dan-penerapan-pemasaran",
  "slug": "anatomi-ai-dan-penerapan-pemasaran",
  "internalRoute": "/anatomi-ai-dan-penerapan-pemasaran",
  "publicCanonicalPath": "/blog/anatomi-ai-dan-penerapan-pemasaran",
  "canonicalPath": "/blog/anatomi-ai-dan-penerapan-pemasaran",
  "canonicalUrl": "https://nexamos.cloud/blog/anatomi-ai-dan-penerapan-pemasaran",
  "title": "Anatomi AI dalam Pemasaran Modern: Potensi, Risiko, dan Kerangka Implementasi Strategis",
  "description": "Praktisi pemasaran harus memahami keterbatasan arsitektur dasar LLM untuk mengoptimalkan manfaat AI sambil memitigasi risiko bias data dan kesalahan konten.",
  "territory": "STRATEGY",
  "articleType": "ANALYSIS",
  "editorialRole": "AUTHORITY",
  "articleContent": {
    "headline": "Anatomi AI dalam Pemasaran Modern: Potensi, Risiko, dan Kerangka Implementasi Strategis",
    "dek": "Praktisi pemasaran harus memahami keterbatasan arsitektur dasar LLM untuk mengoptimalkan manfaat AI sambil memitigasi risiko bias data dan kesalahan konten.",
    "sections": [
      {
        "id": "sec-1",
        "heading": "Anatomi Dasar LLM: Mengapa AI Kadang Salah dan Bagaimana Mencegahnya",
        "content": "Arsitektur dasar LLM seperti Generative Pre-trained Transformer (GPT) dirancang untuk memprediksi kata berikutnya dalam sebuah kalimat berdasarkan probabilitas statistik dari jutaan dokumen pelatihan. Namun, pendekatan statistikal ini memiliki keterbatasan inheren. Ketika model dilatih pada data yang tidak representatif atau mengandung bias sosial, LLM cenderung mereproduksi stereotip atau menghasilkan informasi palsu. Misalnya, penelitian oleh Hovy et al. (claim-1) menunjukkan bahwa model bahasa sering menghubungkan profesi tertentu dengan gender tertentu karena bias dalam dataset pelatihan. Oleh karena itu, governance data yang solid—termasuk cleansing dataset, diversifikasi sumber data, dan audit reguler—merupakan fondasi krusial untuk menjaga integritas konten pemasaran yang dihasilkan oleh AI.",
        "order": 1,
        "purpose": "CONTEXT | ARGUMENT | EVIDENCE | ANALYSIS"
      },
      {
        "id": "sec-2",
        "heading": "Chatbot NLP dalam E-Commerce: Bukti Empiris Peningkatan Konversi dan Retensi",
        "content": "Integrasi chatbot berbasis Natural Language Processing (NLP) pada platform e-commerce enterprise telah menjadi standar untuk meningkatkan layanan pelanggan. Chatbot ini mampu merespons pertanyaan pelanggan secara real-time dengan tingkat akurasi yang sangat tinggi, mengurangi waktu tunggu dan meningkatkan kepuasan pelanggan. Studi kasus dari beberapa perusahaan skala besar menunjukkan implementasi chatbot AI dapat menghasilkan peningkatan konversi hingga 20% dan retensi pelanggan sebesar 15% (claim-2). Untuk mengintegrasikan solusi ini secara efektif, dibutuhkan framework teknis yang kuat, termasuk API management yang andal dan natural language understanding (NLU) yang mampu memahami konteks dan nuansa bahasa lokal. Integrasi ini harus terhubung erat dengan sistem Customer Relationship Management (CRM) dan inventaris untuk memastikan respons yang konsisten dan data yang up-to-date.",
        "order": 2,
        "purpose": "ARGUMENT | EVIDENCE | FRAMEWORK | ANALYSIS"
      },
      {
        "id": "sec-3",
        "heading": "Personalisasi Email Marketing: Kolaboratif vs Konten, Mana yang Lebih Efektif?",
        "content": "Algoritma rekomendasi dalam email marketing menggunakan dua pendekatan utama: collaborative filtering dan content-based filtering. Collaborative filtering menganalisis pola pembelian pelanggan lain untuk membuat rekomendasi, sementara content-based filtering memilih produk berdasarkan preferensi historis individu. Kedua metode ini telah terbukti meningkatkan engagement rate sebesar 7-14%. Namun, ketergantungan pada data historis pengguna menciptakan 'filter bubble', di mana pelanggan hanya menerima rekomendasi yang sesuai dengan preferensi lama, menghalangi eksposur terhadap produk baru. Implikasi bisnisnya adalah potensi hilangnya cross-selling dan inovasi. Praktik audit algoritme yang direkomendasikan termasuk melakukan uji kohort untuk membandingkan segmentasi, menggunakan A/B testing untuk mengukur variasi rekomendasi, dan memasukkan randomization periodic untuk memecah siklus feedback loop yang bias.",
        "order": 3,
        "purpose": "ANALYSIS | IMPLICATION | PRACTICAL_APPLICATION"
      },
      {
        "id": "sec-4",
        "heading": "Generative AI Visual dalam Iklan: Tantangan Komputasional dan Etika yang Terabaikan",
        "content": "Integrasi generative AI untuk pembuatan iklan visual menjanjikan efisiensi produksi yang luar biasa, tetapi juga membawa tantangan teknis dan etis yang signifikan. Model generatif memerlukan overhead komputasi tinggi dan infrastruktur hardware yang mahal, menjadi barrier entry bagi Usaha Kecil Menengah (UKM). Di samping itu, risiko etis seperti plagiarisme visual dan bias estetika sangat nyata. Jika model dilatih pada dataset gambar yang dominan dari budaya tertentu, akan muncul bias estetika yang merugikan kelompok minoritas. Solusi mitigasi yang konkret meliputi penggunaan watermark digital untuk melindungi hak cipta, serta diversifikasi tim data training agar mencerminkan keragaman budaya dan estetika global. Kesimpulannya, adopsi generative AI visual harus dilakukan dengan kerangka governance yang ketat untuk menyeimbangkan inovasi dengan tanggung jawab sosial.",
        "order": 4,
        "purpose": "COUNTERPOINT | IMPLICATION | CONCLUSION"
      }
    ],
    "plainTextSummary": "Arsitektur dasar LLM seperti Generative Pre-trained Transformer (GPT) dirancang untuk memprediksi kata berikutnya dalam sebuah kalimat berdasarkan probabilitas statistik dari jutaan dokumen pelatihan. Namun, pendekatan statistikal ini memiliki keterbatasan inheren. Ketika model dilatih pada data yang tidak representatif atau mengandung bias sosial, LLM cenderung mereproduksi stereotip atau menghasilkan informasi palsu. Misalnya, penelitian oleh Hovy et al. (claim-1) menunjukkan bahwa model bahasa sering menghubungkan profesi tertentu dengan gender tertentu karena bias dalam dataset pelatihan. Oleh karena itu, governance data yang solid—termasuk cleansing dataset, diversifikasi sumber data, dan audit reguler—merupakan fondasi krusial untuk menjaga integritas konten pemasaran yang dihasilkan oleh AI. Integrasi chatbot berbasis Natural Language Processing (NLP) pada platform e-commerce enterprise telah menjadi standar untuk meningkatkan layanan pelanggan. Chatbot ini mampu merespons pertanyaan pelanggan secara real-time dengan tingkat akurasi yang sangat tinggi, mengurangi waktu tunggu dan meningkatkan kepuasan pelanggan. Studi kasus dari beberapa perusahaan skala besar menunjukkan implementasi chatbot AI dapat menghasilkan peningkatan konversi hingga 20% dan retensi pelanggan sebesar 15% (claim-2). Untuk mengintegrasikan solusi ini secara efektif, dibutuhkan framework teknis yang kuat, termasuk API management yang andal dan natural language understanding (NLU) yang mampu memahami konteks dan nuansa bahasa lokal. Integrasi ini harus terhubung erat dengan sistem Customer Relationship Management (CRM) dan inventaris untuk memastikan respons yang konsisten dan data yang up-to-date. Algoritma rekomendasi dalam email marketing menggunakan dua pendekatan utama: collaborative filtering dan content-based filtering. Collaborative filtering menganalisis pola pembelian pelanggan lain untuk membuat rekomendasi, sementara content-based filtering memilih produk berdasarkan preferensi historis individu. Kedua metode ini telah terbukti meningkatkan engagement rate sebesar 7-14%. Namun, ketergantungan pada data historis pengguna menciptakan 'filter bubble', di mana pelanggan hanya menerima rekomendasi yang sesuai dengan preferensi lama, menghalangi eksposur terhadap produk baru. Implikasi bisnisnya adalah potensi hilangnya cross-selling dan inovasi. Praktik audit algoritme yang direkomendasikan termasuk melakukan uji kohort untuk membandingkan segmentasi, menggunakan A/B testing untuk mengukur variasi rekomendasi, dan memasukkan randomization periodic untuk memecah siklus feedback loop yang bias. Integrasi generative AI untuk pembuatan iklan visual menjanjikan efisiensi produksi yang luar biasa, tetapi juga membawa tantangan teknis dan etis yang signifikan. Model generatif memerlukan overhead komputasi tinggi dan infrastruktur hardware yang mahal, menjadi barrier entry bagi Usaha Kecil Menengah (UKM). Di samping itu, risiko etis seperti plagiarisme visual dan bias estetika sangat nyata. Jika model dilatih pada dataset gambar yang dominan dari budaya tertentu, akan muncul bias estetika yang merugikan kelompok minoritas. Solusi mitigasi yang konkret meliputi penggunaan watermark digital untuk melindungi hak cipta, serta diversifikasi tim data training agar mencerminkan keragaman budaya dan estetika global. Kesimpulannya, adopsi generative AI visual harus dilakukan dengan kerangka governance yang ketat untuk menyeimbangkan inovasi dengan tanggung jawab sosial."
  },
  "author": {
    "name": "Tim Riset & Rekayasa NexaMOS",
    "role": "NexaMOS Knowledge & AI Engineering",
    "avatarUrl": "https://nexamos.cloud/authors/default.png"
  },
  "publishedAt": "2026-09-16T02:31:19.587Z",
  "updatedAt": "2026-09-16T02:31:19.587Z",
  "seoMetadata": {
    "metaTitle": "Anatomi AI dalam Pemasaran Modern: Potensi, Risiko, dan Kerangka Implementasi Strategis | NexaMOS",
    "metaDescription": "Praktisi pemasaran harus memahami keterbatasan arsitektur dasar LLM untuk mengoptimalkan manfaat AI sambil memitigasi risiko bias data dan kesalahan konten.",
    "openGraph": {
      "og:title": "Anatomi AI dalam Pemasaran Modern: Potensi, Risiko, dan Kerangka Implementasi Strategis",